{
  "schemaVersion": 1,
  "id": "static-obligations-erased",
  "version": "1.0.0",
  "retained": [
    "K_FEATURE_DEFERRED",
    "K_FEATURE_EXCLUDED",
    "K_IMPORT_ALIAS",
    "K_IMPORT_AMBIGUOUS",
    "K_IMPORT_CYCLE",
    "K_IMPORT_DUPLICATE",
    "K_IMPORT_PRIVATE",
    "K_IMPORT_UNRESOLVED",
    "K_IMPORT_WILDCARD",
    "K_LEX_IDENTIFIER_ASCII",
    "K_LEX_LITERAL",
    "K_LEX_SEMICOLON",
    "K_LEX_TOKEN",
    "K_LEX_TRAILING_COMMA",
    "K_MODULE_FILE_MISMATCH",
    "K_NAME_CONSTRUCTOR_COLLISION",
    "K_NAME_CONVENTION",
    "K_NAME_DUPLICATE",
    "K_NAME_PATTERN_DUPLICATE",
    "K_NAME_SHADOWING",
    "K_PARSE_ALTERNATIVE_SPELLING",
    "K_PARSE_EXPECTED",
    "K_RESOLVE_NAME",
    "K_TYPE_BOUNDARY",
    "K_TYPE_CONDITION",
    "K_TYPE_LOCAL_OPERATOR"
  ],
  "disabled": [
    "K_CHANGE_ADT_VARIANT",
    "K_CHANGE_EFFECT_SET",
    "K_CHANGE_FUNCTION_CONTRACT",
    "K_CHANGE_MODULE_MOVE",
    "K_CHANGE_RECORD_FIELD",
    "K_EFFECT_DUPLICATE",
    "K_EFFECT_MISSING",
    "K_EFFECT_UNUSED",
    "K_IMPORT_UNUSED",
    "K_MATCH_CATCH_ALL",
    "K_MATCH_DUPLICATE",
    "K_MATCH_NON_EXHAUSTIVE",
    "K_MATCH_OPEN_CATCH_ALL",
    "K_MATCH_OVERLAP",
    "K_MATCH_UNREACHABLE",
    "K_TYPE_CALL",
    "K_TYPE_CONSTRUCTOR",
    "K_TYPE_EXACT",
    "K_TYPE_MATCH_ARMS",
    "K_TYPE_RECORD_FIELDS",
    "K_TYPE_RECORD_FIELD_UNKNOWN"
  ]
}
